{
  "name": "bootstrap",
  "description": "Toolchain bootstrap, source mirrors, bootstrap artifacts, and CI cache policy.",
  "owns": [
    "bootstrap/**",
    ".github/workflows/ci.yml",
    "tools/source_mirror",
    "tools/bootstrap_artifact_release.py",
    "tools/repo_sh_tests/**",
    ".agents/facet/bootstrap/**"
  ],
  "consider": [
    {
      "paths": [
        ".agents/repo.json"
      ],
      "skills": [
        "bootstrap-toolchain",
        "cache-hygiene"
      ],
      "reason": "Bootstrap and mirror configuration lives in repo config."
    },
    {
      "paths": [
        ".github/workflows/cache_warm.yml",
        ".agents/facet/maintenance/facet.json"
      ],
      "skills": [
        "cache-hygiene",
        "doc-sync"
      ],
      "reason": "Scheduled cache maintenance must track bootstrap cache keys and cache paths."
    }
  ],
  "commands": [
    {
      "name": "source_mirror",
      "purpose": "List or upload configured byte-identical upstream source mirrors."
    }
  ],
  "checks": [
    {
      "name": "bootstrap_smoke",
      "command": "./repo.sh true",
      "closeout": true
    },
    {
      "name": "pinned_python",
      "command": "./repo.sh python3 --version",
      "closeout": true
    },
    {
      "name": "source_mirror_list",
      "command": "./repo.sh source_mirror list",
      "closeout": true
    }
  ],
  "docs": [
    {
      "surface": "AGENTS.md",
      "projection": "ci"
    },
    {
      "surface": "README.md",
      "projection": "bootstrap"
    }
  ]
}
